{"schema": "v1", "id": "sf-mock01", "fw": "skyfeeder-esp32-1.4.0", "hw": "revC", "mac": "24:6F:28:FA:1C:01", "ip": "10.0.0.231", "capabilities": ["led", "camera", "power", "weight"], "topics": {"discovery": "skyfeeder/sf-mock01/discovery", "status": "skyfeeder/sf-mock01/status", "telemetry": "skyfeeder/sf-mock01/telemetry", "cmd": "skyfeeder/sf-mock01/cmd", "ack": "skyfeeder/sf-mock01/ack"}, "qos": {"discovery": 1, "status": 1, "telemetry": 0, "cmd": 1, "ack": 1}, "ts": "2025-09-21T15:49:15+00:00", "notes": "Mock device published by tools/mock-publisher"}
